backend/astral_kpis.json

{
  "Sales": {
    "unit": "Cr",
    "values": {
      "2017": 1894.67,
      "2018": 2072.92,
      "2019": 2507.3,
      "2020": 2577.9,
      "2021": 3176.3,
      "2022": 4394,
      "2023": 5158.5,
      "2024": 5641.4,
      "2025": 5832.4,
      "2026": 6568.6
    }
  },
  "Raw Material Cost": {
    "unit": "Cr",
    "values": {
      "2017": 1306.19,
      "2018": 1402.08,
      "2019": 1689.8,
      "2020": 1665.6,
      "2021": 1919.7,
      "2022": 3061.4,
      "2023": 3315.5,
      "2024": 3435.8,
      "2025": 3426,
      "2026": 3968.2
    }
  },
  "Change in Inventory": {
    "unit": "Cr",
    "values": {
      "2017": 2.7,
      "2018": 18.71,
      "2019": 42.1,
      "2020": 69.9,
      "2021": -49.2,
      "2022": 133.4,
      "2023": -12.1,
      "2024": 86,
      "2025": 27.8,
      "2026": 17.1
    }
  },
  "Power and Fuel": {
    "unit": "Cr",
    "values": {
      "2017": 43.54,
      "2018": 53.25,
      "2019": 65.3,
      "2020": 70.3,
      "2021": 64.3,
      "2022": 77.7,
      "2023": 101.9,
      "2024": 130.7,
      "2025": 133
    }
  },
  "Other Mfr. Exp": {
    "unit": "Cr",
    "values": {
      "2017": 41.47,
      "2018": 45.22,
      "2019": 54.9,
      "2020": 62.4,
      "2021": 64.9,
      "2022": 87.7,
      "2023": 222.3,
      "2024": 252.4,
      "2025": 274.8
    }
  },
  "Employee Cost": {
    "unit": "Cr",
    "values": {
      "2017": 88.79,
      "2018": 106.58,
      "2019": 139.2,
      "2020": 175.4,
      "2021": 191.3,
      "2022": 245.6,
      "2023": 319.6,
      "2024": 438.4,
      "2025": 517.9,
      "2026": 590.4
    }
  },
  "Selling and admin": {
    "unit": "Cr",
    "values": {
      "2017": 145.48,
      "2018": 157.65,
      "2019": 200.9,
      "2020": 214.1,
      "2021": 227.6,
      "2022": 278.9,
      "2023": 345.2,
      "2024": 510.2,
      "2025": 524.4
    }
  },
  "Other Expenses": {
    "unit": "Cr",
    "values": {
      "2017": 10.58,
      "2018": 12.71,
      "2019": 17.7,
      "2020": 17.9,
      "2021": 21.7,
      "2022": 22.6,
      "2023": 32.3,
      "2024": 35.3,
      "2025": 38.2,
      "2026": 965.2
    }
  },
  "Other Income": {
    "unit": "Cr",
    "values": {
      "2017": 8.01,
      "2018": 12.68,
      "2019": 15.1,
      "2020": 11.3,
      "2021": 25,
      "2022": 34.8,
      "2023": 36.7,
      "2024": 35.7,
      "2025": 41.3,
      "2026": 24.7
    }
  },
  "Depreciation": {
    "unit": "Cr",
    "values": {
      "2017": 50.2,
      "2018": 57.13,
      "2019": 81.4,
      "2020": 107.9,
      "2021": 116.5,
      "2022": 126.9,
      "2023": 178.1,
      "2024": 197.6,
      "2025": 243.4,
      "2026": 291.6
    }
  },
  "Interest": {
    "unit": "Cr",
    "values": {
      "2017": 18.4,
      "2018": 21.58,
      "2019": 31.9,
      "2020": 39.4,
      "2021": 13.1,
      "2022": 12.9,
      "2023": 40,
      "2024": 29.1,
      "2025": 41.3,
      "2026": 64.4
    }
  },
  "Profit before tax": {
    "unit": "Cr",
    "values": {
      "2017": 200.73,
      "2018": 248.11,
      "2019": 283.4,
      "2020": 306.1,
      "2021": 533,
      "2022": 648.5,
      "2023": 628.2,
      "2024": 733.6,
      "2025": 702.5,
      "2026": 730.6
    }
  },
  "Tax": {
    "unit": "Cr",
    "values": {
      "2017": 56.16,
      "2018": 72.45,
      "2019": 86.1,
      "2020": 56.5,
      "2021": 124.8,
      "2022": 158.1,
      "2023": 155.7,
      "2024": 188,
      "2025": 183.6,
      "2026": 195.9
    }
  },
  "Net profit": {
    "unit": "Cr",
    "values": {
      "2017": 144.68,
      "2018": 175.09,
      "2019": 195.8,
      "2020": 247.9,
      "2021": 404.4,
      "2022": 483.8,
      "2023": 456.6,
      "2024": 546.1,
      "2025": 523.8,
      "2026": 534.7
    }
  },
  "Dividend Amount": {
    "unit": "Cr",
    "values": {
      "2017": 7.19,
      "2018": 7.19,
      "2019": 8.4,
      "2020": 15.1,
      "2021": 40.2,
      "2022": 60.3,
      "2023": 94.15,
      "2024": 100.88,
      "2025": 100.88,
      "2026": 67.25
    }
  },
  "Equity Share Capital": {
    "unit": "Cr",
    "values": {
      "2017": 11.98,
      "2018": 11.98,
      "2019": 12,
      "2020": 15.1,
      "2021": 20.1,
      "2022": 20.1,
      "2023": 26.9,
      "2024": 26.9,
      "2025": 26.9,
      "2026": 26.9
    }
  },
  "Reserves": {
    "unit": "Cr",
    "values": {
      "2017": 834.87,
      "2018": 1006.26,
      "2019": 1265.7,
      "2020": 1487.8,
      "2021": 1875.7,
      "2022": 2316.5,
      "2023": 2684.3,
      "2024": 3161.2,
      "2025": 3590.1,
      "2026": 4031
    }
  },
  "Borrowings": {
    "unit": "Cr",
    "values": {
      "2017": 228.97,
      "2018": 189.08,
      "2019": 275.3,
      "2020": 191,
      "2021": 80.2,
      "2022": 98.3,
      "2023": 87.1,
      "2024": 119.4,
      "2025": 233.2,
      "2026": 250.3
    }
  },
  "Other Liabilities": {
    "unit": "Cr",
    "values": {
      "2017": 385.79,
      "2018": 467.7,
      "2019": 546.1,
      "2020": 595.2,
      "2021": 696.7,
      "2022": 952,
      "2023": 1563.8,
      "2024": 1188.3,
      "2025": 1197.6,
      "2026": 1503.7
    }
  },
  "Total": {
    "unit": "Cr",
    "values": {
      "2017": 1461.61,
      "2018": 1675.02,
      "2019": 2099.1,
      "2020": 2289.1,
      "2021": 2672.7,
      "2022": 3386.9,
      "2023": 4362.1,
      "2024": 4495.8,
      "2025": 5047.8,
      "2026": 5811.9
    }
  },
  "Net Block": {
    "unit": "Cr",
    "values": {
      "2017": 741.2,
      "2018": 842.47,
      "2019": 1105.4,
      "2020": 1254.9,
      "2021": 1314.5,
      "2022": 1496,
      "2023": 1950.5,
      "2024": 2299.4,
      "2025": 2711.6,
      "2026": 2945
    }
  },
  "Capital Work in Progress": {
    "unit": "Cr",
    "values": {
      "2017": 24.98,
      "2018": 73.13,
      "2019": 80.8,
      "2020": 44.4,
      "2021": 56.6,
      "2022": 123.2,
      "2023": 126.1,
      "2024": 150.6,
      "2025": 116,
      "2026": 88.7
    }
  },
  "Investments": {
    "unit": "Cr",
    "values": {
      "2019": 0.2,
      "2020": 0.2
    }
  },
  "Other Assets": {
    "unit": "Cr",
    "values": {
      "2017": 695.43,
      "2018": 759.42,
      "2019": 912.7,
      "2020": 989.6,
      "2021": 1301.6,
      "2022": 1767.7,
      "2023": 2285.5,
      "2024": 2045.8,
      "2025": 2220.2,
      "2026": 2778.2
    }
  },
  "Receivables": {
    "unit": "Cr",
    "values": {
      "2017": 338.5,
      "2018": 306.73,
      "2019": 339.1,
      "2020": 227.8,
      "2021": 276.7,
      "2022": 269.1,
      "2023": 354.5,
      "2024": 375.8,
      "2025": 435.3,
      "2026": 475.1
    }
  },
  "Inventory": {
    "unit": "Cr",
    "values": {
      "2017": 272.1,
      "2018": 357.24,
      "2019": 397,
      "2020": 540.4,
      "2021": 472.1,
      "2022": 733.4,
      "2023": 874.6,
      "2024": 913.4,
      "2025": 1011.1,
      "2026": 1117.3
    }
  },
  "Cash & Bank": {
    "unit": "Cr",
    "values": {
      "2017": 18.19,
      "2018": 43.65,
      "2019": 98.1,
      "2020": 130.1,
      "2021": 476,
      "2022": 641.8,
      "2023": 682.1,
      "2024": 609.6,
      "2025": 608.3,
      "2026": 943.4
    }
  },
  "No. of Equity Shares": {
    "unit": "M",
    "values": {
      "2017": 119766565,
      "2018": 119766565,
      "2019": 119806565,
      "2020": 150662206,
      "2021": 200907768,
      "2022": 200907768,
      "2023": 268611572,
      "2024": 268611572,
      "2025": 268611572
    }
  },
  "New Bonus Shares": {
    "unit": "M",
    "values": {
      "2020": 30132441
    }
  },
  "Face value": {
    "unit": "Cr",
    "values": {
      "2017": 1,
      "2018": 1,
      "2019": 1,
      "2020": 1,
      "2021": 1,
      "2022": 1,
      "2023": 1,
      "2024": 1,
      "2025": 1,
      "2026": 1
    }
  },
  "Cash from Operating Activity": {
    "unit": "Cr",
    "values": {
      "2017": 114.19,
      "2018": 281.85,
      "2019": 342,
      "2020": 405.4,
      "2021": 664.1,
      "2022": 543.1,
      "2023": 556.9,
      "2024": 823.4,
      "2025": 629.6,
      "2026": 1117
    }
  },
  "Cash from Investing Activity": {
    "unit": "Cr",
    "values": {
      "2017": -157.98,
      "2018": -185.27,
      "2019": -291.3,
      "2020": -317.7,
      "2021": -454.1,
      "2022": 71.5,
      "2023": -478.1,
      "2024": -541,
      "2025": -512.6,
      "2026": -506.5
    }
  },
  "Cash from Financing Activity": {
    "unit": "Cr",
    "values": {
      "2017": 12.05,
      "2018": -71.11,
      "2019": -5,
      "2020": -163,
      "2021": -153.2,
      "2022": -44,
      "2023": -190.6,
      "2024": -202.5,
      "2025": -118.3,
      "2026": -328.2
    }
  },
  "Net Cash Flow": {
    "unit": "Cr",
    "values": {
      "2017": -31.73,
      "2018": 25.46,
      "2019": 45.7,
      "2020": -75.3,
      "2021": 56.8,
      "2022": 570.6,
      "2023": -111.8,
      "2024": 79.9,
      "2025": -1.3,
      "2026": 282.3
    }
  },
  "PRICE:": {
    "unit": "Cr",
    "values": {
      "2017": 246.45,
      "2018": 401.92,
      "2019": 522.86,
      "2020": 526.98,
      "2021": 1212.64,
      "2022": 1517.21,
      "2023": 1337,
      "2024": 1991.25,
      "2025": 1294.25,
      "2026": 1599
    }
  },
  "Adjusted Equity Shares in Cr": {
    "unit": "Cr",
    "values": {
      "2017": 26.61,
      "2018": 26.61,
      "2019": 26.61,
      "2020": 26.79,
      "2021": 26.79,
      "2022": 26.79,
      "2023": 26.86,
      "2024": 26.86,
      "2025": 26.86,
      "2026": 26.87
    }
  }
}

tests/results/mini_benchmark_baseline.md

## Calculation

FY25:  
\[
= \left(\frac{435.3 + 1011.1 - 1197.6}{5832.4}\right) \times 365 = 15.57 \text{ days}
\]

FY26:  
\[
= \left(\frac{475.1 + 1117.3 - 1503.7}{6568.6}\right) \times 365 = 4.93 \text{ days}
\]

- Net profit margin = \(\frac{534.7}{6568.6} = 0.0814\)
- Asset turnover = \(\frac{6568.6}{5811.9} = 1.130\)
- Financial leverage = \(\frac{5811.9}{4057.9} = 1.433\)